<?xml version="1.0" encoding="UTF-8"?>
<sd:smartDocumentDefinition 
   xmlns:xsi="http://www.w3.org/2001/XMLSchema-instance" 
   xmlns:pp="http://www.processpuzzle.com" 
   xmlns:sd="http://www.processpuzzle.com/SmartDocument" 
   xsi:schemaLocation="http://www.processpuzzle.com/SmartDocument http://processpuzzle.com/Schemas/SmartDocument.xsd">
   
   <sd:name>Comments Document</sd:name>
   <sd:description>Shows comments of associated with the selected content.</sd:description>
   <sd:version>0.5</sd:version>
   
   <sd:resources>
      <sd:styleSheets></sd:styleSheets>
      <sd:images></sd:images>
      <sd:javaScripts></sd:javaScripts>
   </sd:resources>

   <sd:documentHeader tag="div" id="commentsHeader">
      <sd:compositeElement tag="div" id="headerWrapper">
         <sd:element tag="h3">DocumentComments.title</sd:element>
      </sd:compositeElement>
   </sd:documentHeader>
   
   <sd:documentBody tag="div" id="commentsBody">
      <sd:element tag="p">DocumentComments.introduction</sd:element>
   </sd:documentBody>   
</sd:smartDocumentDefinition>
