<?xml version="1.0" encoding="UTF-8"?>
<sd:smartDocumentDefinition 
   xmlns:xsi="http://www.w3.org/2001/XMLSchema-instance" 
   xmlns:pp="http://www.processpuzzle.com" 
   xmlns:sd="http://www.processpuzzle.com/SmartDocument" 
   xsi:schemaLocation="http://www.processpuzzle.com/SmartDocument http://processpuzzle.com/Schemas/SmartDocument.xsd">
   
   <sd:name>Error Page</sd:name>
   <sd:description>Displayed when and error occurred in the front-end.</sd:description>
   <sd:version>0.5</sd:version>
   
   <sd:resources>
      <sd:styleSheets></sd:styleSheets>
      <sd:images></sd:images>
      <sd:javaScripts></sd:javaScripts>
   </sd:resources>

   <sd:documentBody tag="div" id="errorDocumentBody">
      <sd:element tag="h1" id="errorTitle">ErrorDocument.title</sd:element>
      <sd:element tag="p" id="errorTitle">ErrorDocument.introduction</sd:element>
   </sd:documentBody>
   
</sd:smartDocumentDefinition>
